Candidate,Source_Description,URL
Jasmeet Bains,Coauthored AB 489 enacted October 11 2025 restricting deceptive use of AI in health-care advertising and functionality,https://leginfo.legislature.ca.gov/faces/billNavClient.xhtml?bill_id=202520260AB489
Randy Villegas,Working Families Party endorsement release highlights healthcare and economic priorities for his CA-22 campaign but no AI policy or AI regulation position found,https://workingfamilies.org/2025/07/working-families-party-endorses-randy-villegas-for-congress-in-ca-22/
Eric Garcia,Current 2026 CA-22 candidate summaries list Garcia as a declared Democratic candidate; no AI policy or AI regulation position found,https://en.wikipedia.org/wiki/2026_United_States_House_of_Representatives_elections_in_California
Ammar Campa-Najjar,Campaign priorities emphasize democracy costs jobs healthcare and anti-corruption but no AI policy or AI regulation position found,https://www.ammarforcongress.com/
Abel Chavez,Campaign platform focuses affordability healthcare housing schools and broadband with no AI policy or AI regulation position found,https://abelchavezforcongress.com/
Corinna Contreras,Campaign site highlights housing transit homelessness and labor issues with no AI policy or AI regulation position found,https://www.contreras4congress.com/
Jim Desmond,Proposed San Diego County study of AI data center regulation including environmental land-use and infrastructure safeguards,https://www.eenews.net/articles/san-diego-county-will-consider-regulating-ai-data-centers/
Jim Desmond,Campaign site centers costs border security and deregulation with no broader AI safety platform beyond the local data-center issue,https://www.desmondforcongress.com/
Brian Nash,Campaign issue page says 'AI & Emerging Tech: Innovation Without Guardrails Is a Threat' and argues for government guardrails before harms escalate,https://briannash.com/ai-emerging-tech-innovation-without-guardrails-is-a-threat/
Ferguson Porter,Campaign site confirms active CA-48 candidacy but no AI policy or AI regulation position found,https://voteporterforcongress.com/
Brandon Riker,Campaign issues page focuses affordability stability and opportunity with no AI policy or AI regulation position found,https://rikerforcongress.com/
Gabe Evans,Promoted the Trump AI Action Plan for removing prior AI guardrails and accelerating AI dominance,https://gabeevans.house.gov/media/press-releases/rep-evans-and-deputy-secretary-labor-highlight-co-08s-ai-workforce-innovation
Gabe Evans,Official site says he voted for the July 3 2025 budget package that included the federal moratorium on state AI regulation,https://gabeevans.house.gov/issues/energy
Shannon Bird,Voted to advance Colorado's 2025 consumer-protections bill for AI interactions in committee,https://leg.colorado.gov/committee_meeting_hearing_items/2469/votes/4202
Shannon Bird,Colorado Chamber agenda lists Bird presenting an AI policy proposal during the 2025 special-session debate,https://cochamber.com/event/technology-alliance-meeting-4/
Manny Rutinel,Co-led Colorado whistleblower protections bill for large AI companies and said AI safety threats should be reportable without retaliation,https://www.lawweekcolorado.com/article/bipartisan-bill-aims-to-protect-whistleblowers-at-large-artificial-intelligence-companies/
Manny Rutinel,Sponsored Colorado's major 2025 AI discrimination and transparency law,https://gazette.com/2025/08/29/advocates-say-delay-of-colorado-ai-regulations-offers-breathing-room-but-not-final-resolution/
Evan Munsing,Campaign site confirms active CO-08 candidacy but no AI policy or AI regulation position found,https://www.evanmunsing.com/
Mariannette Miller-Meeks,Hosted congressional briefing on responsible healthcare AI emphasizing privacy ethics and clinician oversight,https://millermeeks.house.gov/media/press-releases/rep-miller-meeks-hosts-capitol-hill-briefing-showcasing-breakthroughs
Mariannette Miller-Meeks,Proudly backed the July 3 2025 House bill that included the federal moratorium on state AI regulation,https://millermeeks.house.gov/media/press-releases/one-big-beautiful-bill-passes-house-headed-president-trumps-desk
David Pautsch,Campaign site emphasizes MAGA conservatism taxes border and family issues with no AI policy or AI regulation position found,https://www.davidpautsch.com/about-2/
Christina Bohannan,Campaign site focuses costs healthcare democracy and broadband with no AI policy or AI regulation position found,https://bohannanforcongress.com/about/
Travis Terrell,Campaign issues page focuses workers healthcare democracy and equality with no AI policy or AI regulation position found,https://terrellforcongress.com/
Zach Nunn,Introduced Federal Artificial Intelligence Risk Management Act requiring federal agencies to use NIST AI risk-management safeguards,https://nunn.house.gov/2024/01/11/nunn-introduces-bipartisan-bill-protect-americans-data/
Zach Nunn,Introduced AI PLAN Act and publicly argued for AI guardrails against fraud scams and foreign manipulation,https://nunn.house.gov/2025/09/18/%F0%9F%92%BB-ai-guardrails/
Sarah Trone Garriott,Current campaign messaging focuses costs healthcare and reproductive freedom with no AI policy or AI regulation position found,https://emilyslist.org/news/emilys-list-endorses-state-sen-sarah-trone-garriott-for-iowas-3rd-congressional-district/
Xavier Carrigan,Campaign issues page emphasizes Medicare for All climate and money-in-politics reforms with no AI policy or AI regulation position found,https://www.xcarrigan.com/issues.html
Tom Barrett,Chaired House VA hearing on artificial intelligence in veterans care and backs AI modernization within the VA,https://www.congress.gov/119/chrg/CHRG-119hhrg61916/CHRG-119hhrg61916.pdf
Tom Barrett,Voted for the July 3 2025 House bill that included the federal moratorium on state AI regulation,https://barrett.house.gov/media/press-releases/barrett-delivers-permanent-tax-relief-michigan-families-sends-one-big
Bridget Brink,Campaign site focuses democracy national security affordability and rights with no AI policy or AI regulation position found,https://bridgetbrink.com/
Elyon Badger,Campaign platform calls for a Technology Bill of Rights and explicitly says to BAN most AI,https://elyonbadger.com/
Alexandra Prieditis,Petition opposes unchecked AI data-center construction and calls for stronger environmental review and limits,https://www.change.org/p/stop-ai-data-center-construction-along-the-great-lakes
Tom Kean Jr.,Introduced bipartisan bill criminalizing and creating civil penalties for non-consensual AI deepfake pornography,https://kean.house.gov/media/press-releases/kean-morelle-introduce-bipartisan-legislation-combat-harmful-deepfake
Tom Kean Jr.,Introduced bipartisan bill to strengthen export-control enforcement for stolen AI chips and add whistleblower protections,https://kean.house.gov/media/press-releases/kean-johnson-introduce-bill-protect-american-ai-chips-strengthening-export
Beth Adubato,Campaign site focuses rights safety and dignity with no AI policy or AI regulation position found,https://www.beth4nj.com/
Rebecca Bennett,Campaign site emphasizes healthcare national security and affordability with no AI policy or AI regulation position found,https://rebeccabennettforcongress.com/
Felipe Santos,FEC filing confirms active NJ-07 Democratic candidacy; no AI policy or AI regulation position found,https://www.fec.gov/data/candidate/H6NJ07227/
Mike Lawler,Introduced CHAT Act to impose safeguards on AI companion chatbots interacting with minors,https://lawler.house.gov/news/documentsingle.aspx?DocumentID=5383
Mike Lawler,Voted for the May 22 2025 House package that contained the federal moratorium on state AI regulation,https://lawler.house.gov/news/documentsingle.aspx?DocumentID=4262
John Cappello,Campaign site emphasizes service integrity and values with no AI policy or AI regulation position found,https://www.cappelloforcongress.com/
Peter Chatzky,Campaign priorities focus affordability democracy and security with no AI policy or AI regulation position found,https://www.chatzkyforcongress.com/priorities
Cait Conley,Co-authored Foreign Affairs essay warning that AI threatens democracy through election misinformation and calling for protective government action,https://www.foreignaffairs.com/united-states/artificial-intelligences-threat-democracy
Cait Conley,As CISA senior adviser said AI-driven election threats require active monitoring and safeguards against foreign influence,https://direct.usagm.gov/record/550609
Beth Davidson,Campaign site focuses cost of living safety and environment with no AI policy or AI regulation position found,https://bethdavidsonforcongress.com/
Effie Phillips-Staley,Campaign priorities focus housing childcare Medicare for All and ICE abolition with no AI policy or AI regulation position found,https://effieforcongress.com/
Mike Sacks,Campaign platform focuses democracy healthcare and housing with no AI policy or AI regulation position found,https://www.mikesacksforcongress.com/
Greg Landsman,Introduced Ban AI Denials in Medicare Act to prohibit AI prior-authorization models from delaying or denying Medicare procedures,https://landsman.house.gov/posts/landsman-watson-coleman-introduce-bill-to-prohibit-ai-model-from-denying-medicare-procedures
Greg Landsman,Introduced bill to protect residents from rising electricity costs caused by AI data centers,https://landsman.house.gov/posts/landsman-beyer-introduce-bill-to-protect-residents-from-rising-costs-caused-by-ai-data-centers
Damon Lynch IV,Campaign platform focuses wages housing voting rights and anti-corporate politics with no AI policy or AI regulation position found,https://friendsofdamonlynch.com/
Holly Adams,Campaign site emphasizes faith family and America First politics with no AI policy or AI regulation position found,https://www.hollyadamsforcongress.com/
Eric Conroy,Campaign issues page covers border security veterans and cryptocurrency but no AI policy or AI regulation position found,https://ericconroy.com/
Steven Erbeck,Campaign site focuses cost of living housing and healthcare with no AI policy or AI regulation position found,https://www.erbeckforcongress.com/
Rosemary Oglesby-Henry,Campaign site emphasizes taxes and grassroots outreach with no AI policy or AI regulation position found,https://www.votemsrosemary.com/
John Hancock,Campaign site confirms Libertarian OH-01 candidacy with no AI policy or AI regulation position found,https://hancock4liberty.com/
Marcy Kaptur,Demanded more transparency from AI data centers on energy use and promised to fight for community protections,https://www.youtube.com/watch?v=jF-oUu1trLw
Marcy Kaptur,Reintroduced bipartisan bill to protect inventors and small patent holders as AI-related innovation accelerates,https://kaptur.house.gov/media-center/press-releases/kaptur-massie-reintroduce-bipartisan-bill-protect-american-inventors
Derek Merrin,Campaign site centers tax cuts deregulation and America First politics with no AI policy or AI regulation position found,https://www.derekmerrin.com/
Alea Nadeem,Campaign technology platform backs AI innovation with clear and reasonable regulation to protect against bad actors and cybercrime,https://aleaforcongress.com/issues/embracing-blockchain-technology-and-cryptocurrencies/
Josh Williams,Cosponsored Ohio HB106 to let schools buy artificial-intelligence firearm-detection software,https://www.legislature.ohio.gov/legislation/136/HB106
Josh Williams,Framed AI as part of the Trump agenda in his July 17 2025 'Big Beautiful Breakdown' commentary,https://wowo.com/the-big-beautiful-breakdown-artificial-intelligence/
David Gedert,FEC candidate filing confirms active Libertarian OH-09 candidacy; no AI policy or AI regulation position found,https://www.fec.gov/data/candidate/H6OH09156/
Ryan Mackenzie,Led Pennsylvania legislation and later backed federal law against AI-generated deepfake sexual exploitation and explicit images,https://mackenzie.house.gov/media/press-releases/congressman-ryan-mackenzie-attends-white-house-signing-take-it-down-act
Ryan Mackenzie,As a state representative introduced Pennsylvania legislation to criminalize AI-generated deepfake pornographic images,https://www.pahousegop.com/News-Print/34889/Latest-News/Mackenzie-Applauds-Passage-of-Bill-to-Combat-AI-Generated-Deepfake-Pornographic-Images-
Bob Brooks,Campaign site focuses affordability healthcare and working families with no AI policy or AI regulation position found,https://brooksforcongress.com/
Ryan Crosswell,Campaign centers affordability and rule of law with no AI policy or AI regulation position found,https://ryancrosswell.com/ryan-crosswell-announces-candidacy-for-pa-07-congressional-seat/
Lamont McClure,Campaign site focuses affordability opioids labor and healthcare with no AI policy or AI regulation position found,https://mcclureforpa.com/
Carol Obando-Derstine,Campaign priorities page focuses costs healthcare small business and clean energy with no AI policy or AI regulation position found,https://www.carolforpa.com/priorities/
Michael Granados,Lehigh Valley News identified Granados as an independent PA-07 candidate with no AI policy or AI regulation position found,https://www.lehighvalleynews.com/elections/lehigh-valley-congressional-candidates-raised-1-5-million-new-campaign-finance-reports-show
Scott Perry,Official site news and vote pages show no clear AI safety or AI regulation record found,https://perry.house.gov/news/
Justin Douglas,Campaign site emphasizes accountability anti-corruption and town halls with no AI policy or AI regulation position found,https://www.justindouglas.us/events
Janelle Stelson,Current campaign endorsements and launch coverage focus democracy and costs with no AI policy or AI regulation position found,https://emilyslist.org/news/emilys-list-endorses-janelle-stelson-for-election-to-pennsylvanias-10th-congressional-district-2/
Isabelle Harman,Campaign site emphasizes independent representation and community voice with no AI policy or AI regulation position found,https://www.isabelleharman2026.com/
Steven Long,Current 2026 race listings identify Long as an independent PA-10 candidate with no AI policy or AI regulation position found,https://en.wikipedia.org/wiki/2026_United_States_House_of_Representatives_elections_in_Pennsylvania
Vicente Gonzalez,Served on House Financial Services Task Force on Artificial Intelligence and participated in multiple AI oversight hearings on ethics cloud computing and financial services,https://www.congress.gov/event/117th-congress/house-event/114125/text
Vicente Gonzalez,Cosponsored 2025 Medicare prior-authorization reform bill amid growing concerns about automated denials and AI-driven insurance decision systems,https://www.congress.gov/bill/119th-congress/house-bill/3514/text
Eric Flores,Won the March 3 2026 Republican primary and advanced as the GOP nominee in TX-34,https://www.yahoo.com/news/articles/eric-flores-trounces-mayra-flores-045900364.html
Eric Flores,Campaign platform emphasizes border security energy and Trump-aligned priorities with no AI policy or AI regulation position found after broader search,https://www.ericflores.com/
Jen Kiggans,Introduced AI for America Act calling for a federal AI strategy while also removing regulatory barriers to adoption,https://kiggans.house.gov/posts/kiggans-leads-bill-to-strengthen-u-s-leadership-in-ai
Jen Kiggans,Introduced LIFT Act to expand civilian drone use and explicitly allow AI-assisted waiver processing,https://shoredailynews.com/headlines/kiggans-introduces-drone-act/
William Matthews,FEC filing confirms active Republican candidacy in VA-02; no AI policy or AI regulation position found,https://www.fec.gov/data/candidate/H6VA02206/?cycle=2026
William Matthews,GoFundMe campaign pitch focuses school security and accountability with no AI policy or AI regulation position found,https://www.gofundme.com/f/william-for-congress-people-before-politics
Nila Devanath,Campaign site promises data-driven solutions on healthcare education and safe communities but no AI policy or AI regulation position found,https://niladevanath.com/
Elaine Luria,2026 campaign launch and endorsement coverage focus cost of living national security and abortion rights with no AI policy or AI regulation position found,https://emilyslist.org/news/emilys-list-endorses-elaine-luria-for-virginias-2nd-congressional-district/
Patrick Mosolf,Campaign issues page has a dedicated AI plank warning of unemployment and dominance risks and calling for proactive U.S. and international regulation,https://www.patrickmosolf.com/issues
Nicolaus Sleister,FEC filing confirms active Democratic candidacy in VA-02; no AI policy or AI regulation position found,https://www.fec.gov/data/candidate/H2VA02098/
Matt Strickler,FEC filing confirms active Democratic candidacy in VA-02; no AI policy or AI regulation position found,https://www.fec.gov/data/candidate/H6VA02180/
Burk Stringfellow,Campaign site emphasizes anti-oligarchy and democracy reform with no AI policy or AI regulation position found,https://burkstringfellow.com/
Makiba Gaines,FEC filing confirms active independent candidacy in VA-02; no AI policy or AI regulation position found,https://docquery.fec.gov/pdf/292/202602269837862292/202602269837862292.pdf
Bishop Staten,FEC committee filing confirms active independent candidacy in VA-02; no AI policy or AI regulation position found,https://www.fec.gov/data/committee/C00930552/
Marie Gluesenkamp Perez,Official congressional materials mention AI only in administrative contest rules and broader campaign messaging but no substantive AI policy or AI regulation position found,https://gluesenkampperez.house.gov/congressional-art-competition
John Braun,Sponsored 2026 Washington bill to use agentic AI to streamline regulations and reduce red tape,https://lawfilesext.leg.wa.gov/biennium/2025-26/Pdf/Bills/Senate%20Bills/6254.pdf
John Braun,"Opposed Washington bill requiring bargaining over certain workplace AI uses, arguing it would slow implementation and limit efficiency",https://lawfilesext.leg.wa.gov/biennium/2025-26/Htm/Bill%20Reports/Senate/1622-S.E%20SBR%20WM%20TA%2025.htm
Antony Barran,Campaign platform emphasizes deregulation and small-business growth with no AI policy or AI regulation position found after broader search,https://www.barranforcongress.com/about-antony
Brent Hennrich,Current 2026 WA-03 race listings identify Hennrich as an active Democratic challenger with no AI policy or AI regulation position found,https://en.wikipedia.org/wiki/2026_United_States_House_of_Representatives_elections_in_Washington
Derrick Van Orden,Official press releases and campaign materials emphasize defense innovation and veterans issues but no specific AI policy or AI regulation position found after broader search,https://vanorden.house.gov/media/press-releases/van-orden-statement-fy2026-national-defense-authorization-act
Rebecca Cooke,Campaign site focuses rural opportunity corruption and family economics with no AI policy or AI regulation position found after broader search,https://cookeforwisconsin.com/
Emily Berge,Campaign materials and candidate profiles focus affordability housing and public service with no AI policy or AI regulation position found after broader search,https://pbswisconsin.org/candidate/emily-berge/
Rodney Rave,Campaign site focuses rural representation healthcare and cost of living with no AI policy or AI regulation position found after broader search,https://www.raveforcongress.com/
Adam Gray,Official congressional and campaign materials emphasize agriculture water and Valley jobs but no substantive AI policy or AI regulation position found after broader search,https://gray.house.gov/
Alberto Escobedo,Filed as an independent candidate in CA-13 and no AI policy or AI regulation position found,https://en.wikipedia.org/wiki/2026_United_States_House_of_Representatives_elections_in_California
Daniel Garibay Rodriguez,FEC filing and current candidate lists identify Rodriguez as a Democratic candidate in CA-13 with no AI policy or AI regulation position found,https://www.thegreenpapers.com/G26/CA
Angelina Sigala,FEC filing confirms active Democratic candidacy in CA-13 with no AI policy or AI regulation position found,https://www.fec.gov/data/candidate/H6CA13173/
Javier Lopez,Campaign site emphasizes public safety and conservative leadership with no AI policy or AI regulation position found after broader search,https://www.javierforcongress.com/
Kevin Lincoln,Campaign site focuses Valley cost of living and public safety with no AI policy or AI regulation position found after broader search,https://www.kevinlincolnforcongress.com/
Vin Kruttiventi,Campaign touts massive investment in AI and AgTech as part of a Valley prosperity platform but gives no clear safety or governance guardrails,https://www.vin4congress.com/news-media/new-209-times-poll-vin-kruttiventi-leads-gop-field-with-bold-plan-for-valley-prosperity
Derek Tran,Cosponsored the bipartisan China AI Power Report Act to require annual reporting on advanced PRC AI capabilities,https://www.congress.gov/bill/119th-congress/house-bill/6275/all-info
Derek Tran,Cosponsored the LIFT AI Act to expand K-12 artificial-intelligence literacy education,https://www.congress.gov/bill/119th-congress/house-bill/5584/all-info
Brian Forde,Current CA-45 candidate lists identify Forde as a Democratic filer with no AI policy or AI regulation position found in this race,https://en.wikipedia.org/wiki/2026_United_States_House_of_Representatives_elections_in_California
Chi Charlie Nguyen,Campaign site promotes workforce training and emerging technologies but no AI policy or AI regulation position found after broader search,https://www.charlieforcongress.com/
Chuong Vo,Campaign site focuses safety affordability and accountability with no AI policy or AI regulation position found after broader search,https://www.vo4congress.com/
Amy Phan West,Campaign site stresses affordability and deregulation with no AI policy or AI regulation position found after broader search,https://www.amyphanwest.com/
Jared Moskowitz,Cosponsored RESTRICT Act to block advanced AI chip sales to China and add security requirements for overseas data centers,https://democrats-foreignaffairs.house.gov/2025/12/meeks-introduces-bill-to-block-sales-of-advanced-ai-chips-to-china
Jared Moskowitz,Cosponsored House resolution urging robust transparent safeguards for AI against antisemitic amplification,https://trackbill.com/bill/us-congress-house-resolution-963-condemning-antisemitism-in-all-its-forms-including-the-proliferation-and-amplification-of-antisemitic-content-on-artificial-intelligence-ai-platforms-urging-robust-transparent-safeguards-for-ai-and-recognizing-stakeholders-working-to-counter-this-threat/2760715/
Oliver Larkin,Campaign platform focuses Medicare for All housing labor and democracy with no AI policy or AI regulation position found after broader search,https://www.oliverforcongress.com/
Joe Kaufman,Campaign site focuses counterterrorism border security and inflation with no AI policy or AI regulation position found after broader search,https://kaufmanforcongress.com/
Raven Harrison,Campaign site focuses conservative cultural issues and limited government with no AI policy or AI regulation position found after broader search,https://www.ravenharrisonforcongress.com/
George Moraitis,Campaign site emphasizes America First themes veteran service and freedom with no AI policy or AI regulation position found after broader search,https://george4congress.com/
Kristen McDonald Rivet,Official congressional materials focus jobs manufacturing child care and Great Lakes issues with no substantive AI policy or AI regulation position found after broader search,https://mcdonaldrivet.house.gov/
Amir Hassan,Campaign site and public rollout emphasize national security border security and public safety with no AI policy or AI regulation position found after broader search,https://hassanformi.com/
Alfred Lemmo,FEC filing confirms active Republican candidacy in MI-08 with no AI policy or AI regulation position found,https://www.fec.gov/data/candidate/H6MI08118/
Brinker Harding,Campaign site focuses growth public safety and affordability with no AI policy or AI regulation position found after broader search,https://www.brinkerharding.com/
Kishla Askins,Campaign site emphasizes veterans healthcare and opportunity with no AI policy or AI regulation position found after broader search,https://www.kishlaforcongress.com/
John Cavanaugh,Introduced Nebraska bill LB1203 requiring conspicuous disclosure when political ads use artificial intelligence,https://www.publicnewsservice.org/2024-02-28/civic-engagement-and-voting/ne-legislature-to-hear-bills-regulating-artificial-intelligence/a89122-1
John Cavanaugh,Introduced LB615 to prohibit deceptive AI-generated political deepfakes and criticized federal efforts to block state AI regulation,https://platteinstitute.org/research-note-how-changes-in-ai-regulation-could-affect-nebraska/
James Leuschen,Campaign site focuses anti-corruption voting rights and workers with no AI policy or AI regulation position found after broader search,https://www.jamesleuschen.com/
Denise Powell,Campaign site emphasizes democracy affordability and rights with no AI policy or AI regulation position found after broader search,https://deniseforcongress.org/
Crystal Rhoades,Campaign site focuses democracy healthcare and working families with no AI policy or AI regulation position found after broader search,https://crystal4congress.com/
Melanie Williams,Campaign site focuses education affordability and rights with no AI policy or AI regulation position found after broader search,https://melaniewilliamsforcongress.com/
