Candidate,Source_Description,URL
Katie Hobbs,Launched Arizona's first AI Steering Committee (19 experts from govt/academia/industry),https://azgovernor.gov/office-arizona-governor/news/2025/05/governor-katie-hobbs-announces-members-arizonas-first-ai
Katie Hobbs,OSI announcement of AI Steering Committee members,https://osi.az.gov/news/governor-katie-hobbs-announces-members-arizonas-first-ai-steering-committee
Katie Hobbs,AZ Tech Council coverage – committee focused on privacy / fairness / access,https://www.aztechcouncil.org/news/governor-hobbs-announces-arizonas-first-ai-steering-committee/
Katie Hobbs,KJZZ coverage – committee to deliver policy recommendations by spring 2026,https://www.kjzz.org/politics/2025-05-21/governor-hobbs-announces-members-of-ai-steering-committee
Andy Biggs,Discussed AI data center growth and SMRs for energy at ASU event,https://news.asu.edu/20250818-local-national-and-global-affairs-us-rep-andy-biggs-arizona-energy-path-asu-event
Andy Biggs,House Oversight Committee AI hearing (June 2025 – transcript),https://www.congress.gov/119/meeting/house/118339/documents/HHRG-119-GO00-Transcript-20250605.pdf
Andy Biggs,Congress.gov profile,https://www.congress.gov/member/andy-biggs/B001302
David Schweikert,'We're in trouble' on AI adoption pace – op-ed on regulating AI,https://schweikert.house.gov/2025/03/27/were-in-trouble-congressman-david-schweikert-on-ai-adoption-societal-resistance-on-regulating-ai/
David Schweikert,Dedicated Innovation & AI issues page,https://schweikert.house.gov/issues/innovation-ai/
David Schweikert,Introduced AI healthcare bills – Healthy Technology Act of 2025 (first AI bills of 119th Congress),https://insideaipolicy.com/ai-daily-news/rep-schweikert-offers-first-ai-bills-119th-congress-focusing-healthcare-uses
David Schweikert,NDAA amendments passed to expand AI integration in Dept of Defense,https://schweikert.house.gov/2025/09/26/congress-votes-yay-on-rep-schweikerts-ndaa-amendments-2025/
David Schweikert,Op-ed: Using AI to stabilize national debt,https://schweikert.house.gov/2024/05/01/schweikert-using-ai-to-our-advantage-can-help-us-stabilize-the-debt/
David Schweikert,American Bazaar coverage of AI adoption / regulation views,https://americanbazaaronline.com/2025/03/27/congressman-david-schweikert-on-ai-adoption-societal-resistance-on-regulating-ai-461187/
Tom Steyer,"Steyer AI/tech plan: tougher AI regulations, sovereign wealth fund from AI profits, require data centers to pay their own way, protect workers and kids from AI",https://www.eenews.net/articles/tom-steyers-tech-and-ai-plan/
Tom Steyer,"Axios: Steyer joins race — emphasizes AI regulation as major issue, refuses to let California's AI boom benefit only billionaires",https://www.axios.com/2025/11/19/tom-steyer-2026-race-california-governor
Tom Steyer,"CalMatters: Steyer first major candidate to detail AI policy — sovereign wealth fund, data center costs, worker protections",https://calmatters.org/politics/2025/11/california-governors-race-tom-steyer/
Katie Porter,"CalMatters 2024 Senate voter guide: Porter called for 'meaningful regulation of AI, as well as greater clean energy investments that empower workers'",https://calmatters.org/california-voter-guide-2024/us-senate/katie-porter/
Katie Porter,Katie Porter campaign website — official platform,https://katieporter.com/
Eric Swalwell,Swalwell serves on House Courts/IP/Artificial Intelligence/Internet subcommittee — key AI oversight role in Congress,https://swalwell.house.gov/about/committees-and-caucuses
Eric Swalwell,Swalwell tweet mocking Greene for missing AI state-preemption clause in OBBBA — voted against the bill (which contained 10-year moratorium on state AI laws),https://x.com/RepSwalwell/status/1929953816709083470
Eric Swalwell,Swalwell announces 2026 governor bid — background includes congressional AI oversight work,https://calmatters.org/politics/2026/03/california-governor-candidates/
Antonio Villaraigosa,"Villaraigosa campaign focuses on public safety, housing, affordability — no AI policy positions found; recently served as Coinbase advisor",https://www.antonio2026.com/
Antonio Villaraigosa,CalMatters profile: Villaraigosa on second gubernatorial run — no tech/AI platform mentioned,https://calmatters.org/newsletter/antonio-villaraigosa-california-governor-2026/
Xavier Becerra,Becerra campaign focuses on healthcare and affordability — no AI policy positions found despite serving as HHS Secretary during major AI health debates,https://www.xavierbecerra2026.com/
Xavier Becerra,SF Examiner profile of Becerra's 2026 candidacy — no AI positions mentioned,https://www.sfexaminer.com/news/politics/2026-california-governor-race-get-to-know-xavier-beccera/article_00b241f6-3fd1-456f-bb91-9a3162a89241.html
Tony Thurmond,Thurmond convened CA AI in Education workgroup as Superintendent — 'AI should complement not replace' human relationships; focused on K-12 AI literacy,https://www.cde.ca.gov/nr/ne/yr25/yr25rel39.asp
Tony Thurmond,AACTE: Thurmond sponsored SB 1288 establishing CA as first state with legislatively mandated statewide K-12 AI workgroup,https://edprepmatters.aacte.org/california-convenes-statewide-ai-in-education-workgroup-for-public-schools/
Matt Mahan,Bloomberg: Mahan aims to make San Jose 'most AI-enabled city hall' — pushing AI adoption across 7000 city workers,https://www.bloomberg.com/news/articles/2025-07-18/san-jose-mayor-vies-to-create-most-ai-enabled-city-hall
Matt Mahan,"Semafor: Mahan using AI to speed up transportation and government — 20% bus speed improvement, AI grant-writing",https://www.semafor.com/article/09/05/2025/how-san-joses-mayor-is-using-ai-to-speed-up-transportation-government
Matt Mahan,"Bay Area Council: Mahan launches 'AI for All' platform with tech companies — frames AI adoption as civic good, no safety regulation positions",https://www.bayareacouncil.org/artificial-intelligence/council-partners-with-san-jose-mayor-matt-mahan-tech-companies-to-launch-ai-for-all-platform/
Matt Mahan,San Jose Mayor's office: $200K grants to early-stage AI startups — active AI industry incentive program,https://www.sjmayormatt.com/news-room/proposed-last-year-by-mayor-matt-mahan-applications-open-today-for-50k-grants-to-support-early-stage-ai-startups-looking-to-join-vibrant-tech-ecosystem-in-san-jos
Ian Calderon,CalMatters: confirmed filed candidate — former Assembly majority leader; no AI policy positions found,https://calmatters.org/politics/2026/03/california-governor-candidates/
Steve Hilton,"Hilton campaign platform: lower taxes, ease business regulations, deregulation-first agenda — no AI safety positions; echoes anti-China AI arms race framing",https://stevehiltonforgovernor.com/
Steve Hilton,"SF Examiner: Hilton outlines governor plans — gas prices, tax cuts, homelessness; regulation removal central to platform",https://www.sfexaminer.com/news/politics/republican-steve-hilton-outlines-california-governor-plans/article_9d22eb1c-91a6-40b7-bbe7-0151f84fd392.html
Steve Hilton,Fox News/Hilton op-ed: China will use AI against us — anti-China framing to justify deregulating US AI development,https://www.foxnews.com/opinion/steve-hilton-silicon-valleys-surveillance-capitalism-has-resulted-in-big-tech-killing-off-human-privacy
Chad Bianco,ABC7: Bianco says he's 'antithesis to California state government' — will 'take a nuclear bomb' to Sacramento; 'regulations destroying this state are going to be removed with me as governor',https://abc7.com/post/republican-governor-candidate-chad-bianco-says-hes-antithesis-california-state-government/18677627/
Chad Bianco,Bianco campaign priorities page — tech sector framing is 'innovation capital' without any safety or oversight positions,https://biancoforgovernor.com/priorities/
John Hickenlooper,Hickenlooper introduced VET AI Act — directs NIST to develop guidelines for independent third-party audits of AI systems; passed Senate Commerce Committee,https://www.hickenlooper.senate.gov/press_releases/hickenlooper-capito-reintroduce-bipartisan-bill-to-boost-ai-standards-create-guidelines-for-third-party-evaluations-of-ai/
John Hickenlooper,Hickenlooper introduced ARIA Act (AI Research Innovation and Accountability Act) — establishes transparency measures for AI developers and deployers,https://www.hickenlooper.senate.gov/press_releases/hickenlooper-bipartisan-senators-introduce-ai-bill-to-accelerate-innovation-strengthen-u-s-leadership/
John Hickenlooper,Hickenlooper chaired Senate Commerce subcommittee hearing on AI transparency and consumer trust; proposed AI auditing standards and consumer data protections,https://www.hickenlooper.senate.gov/press_releases/video-hickenlooper-chairs-senate-hearing-on-protecting-consumers-from-ai-deepfakes/
John Hickenlooper,"Hickenlooper co-sponsored TAKE IT DOWN Act — criminalizes AI-generated deepfake pornography, requires platform removal",https://www.hickenlooper.senate.gov/press_releases/icymi-hickenlooper-charts-path-for-ai-regulation/
John Hickenlooper,Hickenlooper + Thune urge federal AI standards: 'consumers should be empowered to trust the AI systems they interact with',https://www.hickenlooper.senate.gov/press_releases/hickenlooper-thune-urge-federal-action-on-artificial-intelligence/
John Hickenlooper,On AI self-regulation: 'We can't let an industry with so many unknowns and potential harms police itself' — called for qualified third-party audits,https://www.hickenlooper.senate.gov/press_releases/hickenlooper-proposes-ai-auditing-standards-calls-for-protecting-consumer-data-increasing-transparency/
Julie Gonzales,Gonzales engaged in CO AI law negotiations as state senator: 'All thirty-five of us know the stunning brunt of AI leverage' — specific positions not documented for Senate campaign,https://coloradosun.com/2025/08/25/colorado-ai-law-tweak-dies/
Julie Gonzales,Gonzales Senate campaign platform: running as progressive challenger to Hickenlooper — no AI-specific Senate campaign positions found,https://www.julieforcolorado.com
Mark Baisley,Baisley wants to repeal Colorado SB 205 (landmark state AI regulation law) — replace software-level regulation with just an anti-discrimination statement; 'the new AI law takes the wrong approach',https://www.coloradopolitics.com/2025/08/13/amend-or-repeal-proposals-surface-to-effectively-undo-ai-regulation-law-in-colorado-2/
Mark Baisley,"Baisley: 'critical that we fix Colorado's AI law to keep jobs in Colorado' — frames AI deregulation as economic development, not safety",https://coloradopolitics.com/news/artificial-intelligence-regulations-in-colorado/article_d566655d-da19-49b5-90f1-5db762a62192.html
Janak Joshi,"Joshi: former state Rep, first-time Senate candidate — no AI policy positions found",https://ballotpedia.org/Janak_Joshi
Byron Donalds,Donalds breaks with DeSantis — calls AI 'something magical' and embraces 'creative destruction'; explicitly opposes state-level AI regulation,https://floridapolitics.com/archives/778801-byron-donalds-breaks-with-ron-desantis-on-magical-ai-embraces-technologys-creative-destruction/
Byron Donalds,AI super PAC 'Leading the Future' pledges $5M to Donalds — funded by OpenAI co-founder Greg Brockman and Andreessen Horowitz; industry bet against DeSantis-style regulation,https://www.nbcnews.com/politics/2026-election/super-pac-backed-ai-titans-pledges-5-million-boost-byron-donalds-run-f-rcna258612
Byron Donalds,Donalds: 'parents and Florida should lead regulation of AI' — frames as pro-innovation with only minimal guardrails on IP and deepfakes,https://floridianpress.com/2026/02/byron-donalds-says-parents-florida-should-lead-regulation-of-ai/
Byron Donalds,Donalds supports AI data center expansion in FL; dismisses 'performative' AI critiques; proposes nuclear power to support data center energy demand,https://floridapolitics.com/archives/781341-ai-donalds-byron/
Paul Renner,Renner called Donalds' AI data center support 'greed-mongering at its worst' — criticized collusion between Big Tech and utility companies; demanded Donalds renounce AI data center funding,https://voterenner.com/paul-renner-for-governor-byron-donalds-the-state-of-florida-is-not-for-sale/
Paul Renner,Renner supports using AI to detect government corruption; wants parental opt-in for children's AI use; favors age restrictions; opposes unregulated data center expansion,https://www.wlrn.org/government-politics/2025-09-03/former-florida-house-speaker-paul-renner-enters-race-for-florida-governor/
James Fishback,Fishback pledges to block AI data center construction as governor — motivated by energy cost increases (30-40%) and water usage (500K+ gallons/day),https://x.com/j_fishback/status/2000223922143273227
Jay Collins,Collins (Lt. Gov.) warned about AI energy demands and 'dangers of flawed data influencing public opinion'; expressed concern about children's mental health from AI relationships — no legislative AI record,https://www.news4jax.com/news/local/2026/01/18/lt-gov-jay-collins-enters-governors-race-emphasizing-economy-education-and-community-safety/
David Jolly,"Jolly campaign focuses on affordability, insurance reform, gun safety — no AI-specific policy positions found across website or news coverage",https://floridaphoenix.com/2025/06/05/its-official-david-jolly-is-a-democratic-candidate-for-governor-in-26/
Jerry Demings,"Demings touts Orange County's 20-year AI use: prevented 4M+ cyber intrusions, AI-powered 911 translation, traffic optimization — pragmatic government user; no AI regulatory stance published",https://theapopkachief.com/demings-touts-fiscal-prudence-ai-use-in-2025-state-of-county/
Jason Esteves,Served on Georgia Senate Study Committee on Artificial Intelligence (2024); co-sponsored SB 37 (AI Accountability Act) to create state AI board and require all government entities to develop AI usage plans; stated 'the legislature must support AI while also protecting people from its repercussions',https://ballotpedia.org/Jason_Esteves
Jason Esteves,SB 37 would have required local governments to report AI system usage and created a Georgia Board for Artificial Intelligence — bill did not pass but reflects clear regulatory posture on accountability and oversight,https://atlantaciviccircle.org/2025/03/12/georgia-artificial-intelligence-ai-state-bill-local-government/
Michael Thurmond,Thurmond has made AI workforce readiness a campaign pillar — wants to build 'most AI-proficient workforce in America' using GA technical colleges and universities; focuses on retraining workers for AI economy; no regulatory stance found,https://ballotpedia.org/Michael_Thurmond
Michael Thurmond,"Thurmond stated 'there's a major transformation taking place, and we are not doing enough as a state to retool the current workforce and to prepare our students to be successful' — framing AI as economic opportunity, not regulatory challenge",https://www.gpb.org/news/2025/08/06/democrat-michael-thurmond-launches-2026-run-for-georgia-governor
Keisha Lance Bottoms,"Campaign focuses on Medicaid expansion, teacher tax relief, housing, and healthcare; joined Coinbase advisory council (crypto) but no AI governance or safety positions identified in gubernatorial campaign",https://ballotpedia.org/Keisha_Lance_Bottoms
Geoff Duncan,Former Lt. Gov. championed GA as 'Technology Capital of the East Coast' and launched Partnership for Inclusive Innovation; no AI safety or regulation positions identified in current governor's race campaign,https://ballotpedia.org/Geoff_Duncan
Burt Jones,"As Lt. Governor, empaneled 2025 Senate Study Committee on Impact of Social Media and Artificial Intelligence on Children; backed child safety social media law; no AI governance planks in governor's campaign",https://ballotpedia.org/Burt_Jones
Burt Jones,Large AI data center project proposed on Jones family land in Butts County — raises conflict-of-interest concerns about his relationship to AI infrastructure; framed as economic development not regulation,https://ltgov.georgia.gov/press-releases/2025-05-22/2025-senate-study-committee-appointments
Brad Raffensperger,"Warned publicly about AI deepfake threats to elections; stated 'We're very concerned, because what happens when the fake is so good you don't even know that you've been faked out?' — called for election official preparedness against AI-generated disinformation",https://ballotpedia.org/Brad_Raffensperger
Brad Raffensperger,Referenced AI-generated Biden robocall (NH 2024) as warning example of AI election interference; advocates resources and training for election officials to combat AI threats; framed as preparedness not regulation,https://dailyprogress.com/news/local/government-politics/ai-threat-haunting-2024-elections-says-brad-raffensperger/article_83fdeee2-f5b2-11ee-90e4-5b8822928919.html
Gregg Kirkpatrick,Proposes using AI in government via 'Department of Anti-Corruption' to reduce waste; advocates for responsible AI data center growth requiring environmental protection plans from operators; most explicit AI policy platform in Republican field,https://ballotpedia.org/Gregg_Kirkpatrick
Chris Carr,"No AI positions identified; campaign focuses on public safety, job creation, cost of living, and mental health — no AI regulatory actions from AG office",https://ballotpedia.org/Chris_Carr_(Georgia)
Jon Ossoff,AI & Human Rights hearing (chaired – Senate Human Rights Subcommittee),https://www.ossoff.senate.gov/press-releases/watch-sen-ossoff-convenes-hearing-on-implications-of-artificial-intelligence-for-human-rights/
Jon Ossoff,Oversight of AI: Rules for Artificial Intelligence – Senate hearing (participated),https://www.congress.gov/event/118th-congress/senate-event/LC71543/text
Jon Ossoff,DoD/Grok inquiry – pushed back on Pentagon using xAI Grok over antisemitic outputs,https://www.ossoff.senate.gov/press-releases/sen-ossoff-colleagues-launch-inquiry-into-department-of-defenses-use-of-ai-software-known-for-antisemitic-content/
Jon Ossoff,General legislation tracker (GovTrack),https://www.govtrack.us/congress/members/jon_ossoff/456857
Mike Collins,Federal Science Agencies and the Promise of AI hearing – opening statement (chaired),https://science.house.gov/2024/2/opening-statement-of-subcommittee-chairman-mike-collins-at-joint-research-technology-and-energy-subcommittee-hearing-federal-science-agencies-and-the-promise-of-ai-in-driving-scientific-discoveries
Mike Collins,Federal Science Agencies and the Promise of AI – full hearing record (Congress.gov),https://www.congress.gov/event/118th-congress/house-event/LC74488/text
Mike Collins,AI deepfake campaign ad of Ossoff – CBS Atlanta coverage,https://www.cbsnews.com/atlanta/news/georgia-rep-mike-collins-campaign-uses-ai-generated-deepfake-of-senator-jon-ossoff-in-tight-senate-showdown/
Mike Collins,AI deepfake campaign ad – ethical concerns coverage,https://www.atlantanewsfirst.com/2025/11/18/ai-campaign-ad-hotly-contested-us-senate-race-raises-ethical-questions/
Buddy Carter,Congress.gov profile (Energy & Commerce Committee),https://www.congress.gov/member/earl-carter/C001103
Buddy Carter,Ballotpedia profile,https://ballotpedia.org/Earl_%22Buddy%22_Carter
Derek Dooley,Ballotpedia profile,https://ballotpedia.org/Derek_Dooley
Ashley Hinson,Hinson (Rep. IA-2) supports AI for rural economic development (Google/Microsoft data centers) and national security competitiveness vs. China — no AI safety or consumer protection positions identified,https://punchbowl.news/the-ones-to-watch/advancing-with-ai/ashley-hinson/
Nathan Sage,"Sage (Marine/Army veteran, sports announcer) entered race to connect with working-class voters — no AI policy positions identified",https://www.nbcnews.com/politics/2026-election/iowa-sen-joni-ernst-first-democratic-challenger-2026-nathan-sage-rcna201299
Juliana Stratton,Stratton platform: restrict landlords from using AI to set rents/screen applicants; workers must have seat at table on AI implementation; protect jobs displaced by AI,https://capitolnewsillinois.com/news/stratton-aims-to-bring-pritzker-administration-policies-to-national-stage/
Juliana Stratton,"Stratton blueprint: AI innovation must not benefit only the wealthy — worker upskilling, anti-offshoring, pro-worker AI implementation rules",https://capitolnewsillinois.com/wp-content/uploads/2025/10/JS-LG-Blueprint-Issue-Pamphlet.pdf
Juliana Stratton,IL Pritzker admin (which Stratton seeks to bring to national stage) signed employer AI notification law + anti-discrimination in AI hiring decisions,https://www.employmentlawinsights.com/2024/08/illinois-civil-rights-protection-goes-high-tech-illinois-human-rights-act-expanded-to-include-ai-regulation/
Raja Krishnamoorthi,"Krishnamoorthi: 'We can't repeat with AI what we did with social media' — co-chair of Congressional AI Caucus, pushes for AI safeguards",https://www.nbcchicago.com/illinois-election-2026/raja-krishnamoorthi-lays-out-his-case-in-2026-illinois-senate-primary/3904645/
Raja Krishnamoorthi,Krishnamoorthi + Moolenaar introduce No Adversarial AI Act to bar federal agencies from DeepSeek and CCP-linked AI — China arms race framing,https://democrats-selectcommitteeontheccp.house.gov/media/press-releases/krishnamoorthi-and-moolenaar-lead-bipartisan-bicameral-bill-protect-federal
Raja Krishnamoorthi,Krishnamoorthi + Bera: legislation requiring Congressional approval before sale of advanced AI chips to China — export control focus,https://democrats-selectcommitteeontheccp.house.gov/media/press-releases/krishnamoorthi-bera-introduce-legislation-require-congressional-approval-sale
Raja Krishnamoorthi,Ranking Member of House Select Committee on CCP — his AI work overwhelmingly framed around US-China competition not domestic safety,https://democrats-selectcommitteeontheccp.house.gov/about-committee/ranking-member-raja-krishnamoorthi
Robin Kelly,Kelly tech platform: ensure workers 'prepared to work with AI as a positive tool' — no safety regulation positions; bipartisan work with Hurd to cut China AI chip access and push US AI development,https://robinkelly.house.gov/issues/technology-and-telecommunications
Robin Kelly,"Kelly-Hurd bipartisan plan: cut China's AI chip access, push US resources toward AI development — arms race framing, no safety dimension",https://robinkelly.house.gov/media-center/in-the-news/whats-bipartisan-plan-ai-and-national-security
Robin Kelly,"CBS Chicago 2026 candidate profile: Kelly focuses on Medicare for All, wages, childcare — no AI safety positions in campaign platform",https://www.cbsnews.com/chicago/news/senate-candidate-profile-illinois-congresswoman-robin-kelly/
Don Tracy,"Tracy campaign platform: lower cost of living, decrease tax burden, border security — no AI policy positions found; former IL GOP chairman",https://chicago.suntimes.com/elections/2026/candidate-questionnaires/don-tracy-illinois-primary-united-states-senate
Don Tracy,"IL GOP Senate debate: Tracy, Evans, Chlebek pitched on cost-of-living and border issues — no AI positions surfaced",https://www.stlpr.org/government-politics-issues/2026-02-12/illinois-gop-senate-candidates-first-major-debate
Ed Markey,"Markey introduced AI Civil Rights Act — comprehensive guardrails on algorithmic decisions; requires pre/post-deployment testing; targets bias in hiring, housing, credit, healthcare",https://www.markey.senate.gov/news/press-releases/senator-markey-introduces-ai-civil-rights-act-to-eliminate-ai-bias-enact-guardrails-on-use-of-algorithms-in-decisions-impacting-peoples-rights-civil-liberties-livelihoods
Ed Markey,Markey introduced States' Right to Regulate AI Act (Dec 2025) — led 10 colleagues to block Trump executive order preempting state AI regulation; 'states should be able to protect their residents',https://www.markey.senate.gov/news/press-releases/senator-markey-introduces-legislation-to-block-trumps-executive-order-blocking-state-ai-regulation
Ed Markey,Markey touted win when Senate scrapped proposal to ban state AI regulation (July 2025) — had fought 10-year federal preemption moratorium included in budget reconciliation,https://www.wbur.org/news/2025/07/01/ai-regulation-states-scrapped
Ed Markey,Markey introduced Eliminating BIAS Act — requires every federal agency that uses or funds AI to have a civil rights office focused on combating AI discrimination,https://www.markey.senate.gov/news/press-releases/sen-markey-rep-lee-reintroduce-legislation-to-mandate-civil-rights-offices-in-federal-agencies-that-manage-artificial-intelligence
Ed Markey,Markey co-introduced AI Environmental Impacts Act with Heinrich — requires NIST to develop standards measuring AI energy/water use and e-waste,https://www.markey.senate.gov/news/press-releases/markey-heinrich-eshoo-beyer-introduce-legislation-to-investigate-measure-environmental-impacts-of-artificial-intelligence
Ed Markey,Markey introduced bipartisan Strategy for Public Health Preparedness and Response to AI Threats Act — prepares federal public health infrastructure for AI-enabled health threats,https://www.markey.senate.gov/news/press-releases/markey-budd-introduce-bipartisan-bill-to-prepare-for-ai-public-health-threats
Seth Moulton,Moulton (Armed Services Committee) calls for 'Geneva Convention for AI' — wants international treaty framework for autonomous weapons; warned AI weapons could surpass nuclear weapons in danger,https://www.bostonglobe.com/2023/05/24/opinion/seth-moulton-ai-autonomous-weapons/
Seth Moulton,Moulton also advocates faster US military AI adoption: 'every new weapons system should have an AI component'; led Future of Defense Task Force on AI integration,https://defensescoop.com/2022/11/23/hasc-lawmaker-seth-moulton-urges-faster-adoption-and-more-restraint-of-military-ai/
