Candidate,Source_Description,URL
Lou Correa,Backed bipartisan legislation to integrate AI and other advanced technologies into border security while emphasizing civil rights and civil liberties protections,https://correa.house.gov/news/press-releases/correa-luttrell-re-introduce-bipartisan-legislation-to-integrate-technology-and-border-security
Lou Correa,Supported AI enabled homeland security deployment in hearings but within a rights preserving oversight frame rather than a broader guardrails agenda,https://correa.house.gov/news/press-releases/ranking-member-correa-delivers-opening-statement-in-joint-subcommittee-hearing-smart-investments-technologys-role-in-multi-layered-border-security-strategy
David Pan,Current CA-46 race listings identify Pan as an active filed Republican candidate with no AI policy or AI regulation position found after broader search,https://en.wikipedia.org/wiki/2026_United_States_House_of_Representatives_elections_in_California
Dave Min,Current House and campaign materials did not show a substantive AI policy or AI regulation record in this race after broader search,https://min.house.gov/
Hunter Garcia Miranda,Campaign materials identify Garcia Miranda as an active CA-47 candidate with no AI policy or AI regulation position found after broader search,https://www.hunterforcongress.com/
Bill Brough,Current CA-47 race listings identify Brough as an active filed Republican candidate with no AI policy or AI regulation position found after broader search,https://en.wikipedia.org/wiki/2026_United_States_House_of_Representatives_elections_in_California
Julia Hashemieh,Current CA-47 race listings identify Hashemieh as an active filed Republican candidate with no AI policy or AI regulation position found after broader search,https://en.wikipedia.org/wiki/2026_United_States_House_of_Representatives_elections_in_California
Ryan Lam,Current CA-47 race listings identify Lam as an active filed Republican candidate with no AI policy or AI regulation position found after broader search,https://en.wikipedia.org/wiki/2026_United_States_House_of_Representatives_elections_in_California
Jenny Le Roux,Current CA-47 race listings identify Le Roux as an active filed Republican candidate with no AI policy or AI regulation position found after broader search,https://en.wikipedia.org/wiki/2026_United_States_House_of_Representatives_elections_in_California
Michael Maxsenti,Current CA-47 race listings identify Maxsenti as an active filed Republican candidate with no AI policy or AI regulation position found after broader search,https://en.wikipedia.org/wiki/2026_United_States_House_of_Representatives_elections_in_California
Eric J. Troutman,Current CA-47 race listings identify Troutman as an active filed independent candidate with no AI policy or AI regulation position found after broader search,https://en.wikipedia.org/wiki/2026_United_States_House_of_Representatives_elections_in_California
Mark Takano,Warned publicly about the need for Congress to prepare for AI and other emerging technologies rather than treat them as peripheral issues,https://takano.house.gov/newsroom/press-releases/reps-takano-and-foster-sens-hirono-and-tillis-introduce-the-office-of-technology-assessment-improvement-and-enhancement-act
Mark Takano,Sought disclosure and oversight of AI tools introduced inside the VA under DOGE related modernization efforts,https://www.stripes.com/veterans/2025-06-27/veterans-spyware-doge-18265276.html
Ken Calvert,Current campaign materials emphasize military spending water and immigration with no AI policy or AI regulation position found after broader search,https://www.kencalvert.com/
Joe Kerr,Campaign materials identify Kerr as an active CA-40 Democratic candidate with no AI policy or AI regulation position found after broader search,https://www.joekerrforcongress.com/
Young Kim,Served on the bipartisan House Financial Services AI Working Group and explicitly emphasized both AI opportunity and consumer risk,https://youngkim.house.gov/2024/01/12/rep-young-kim-to-serve-on-bipartisan-ai-working-group/
Nina Linh,Campaign materials identify Linh as an active CA-40 Democratic candidate with no AI policy or AI regulation position found after broader search,https://www.ninalinh.com/
Lisa Ramirez,Campaign materials identify Ramirez as an active CA-40 Democratic candidate with no AI policy or AI regulation position found after broader search,https://www.lisaramirezforcongress.com/
Esther Kim Varet,Campaign materials identify Varet as an active CA-40 Democratic candidate with no AI policy or AI regulation position found after broader search,https://www.estherkimvaret.com/
Hector De La Torre,Campaign materials identify De La Torre as an active CA-41 Democratic candidate with no AI policy or AI regulation position found after broader search,https://hectordelatorre.com/
Dave Karson,Campaign materials identify Karson as an active CA-41 Democratic candidate with no AI policy or AI regulation position found after broader search,https://www.davekarson.com/
Shaaf Patel,Public materials reviewed did not show a substantive AI policy or AI regulation record for Patel after broader search,https://www.facebook.com/shaafpatelforcongress/
Linda Sanchez,Public materials reviewed did not show a substantive AI policy or AI regulation record in this race after broader search,https://lindasanchez.house.gov/
Cody Wiebelhaus,Campaign materials identify Wiebelhaus as an active CA-41 Republican candidate with no AI policy or AI regulation position found after broader search,https://www.codywiebelhaus.com/
Shonique Williams,Campaign materials identify Williams as an active CA-41 Democratic candidate with no AI policy or AI regulation position found after broader search,https://www.shoniquewilliams.com/
Noah Blom,Current CA-42 race listings identify Blom as an active filed Republican candidate with no AI policy or AI regulation position found after broader search,https://en.wikipedia.org/wiki/2026_United_States_House_of_Representatives_elections_in_California
Brian Burley,Current CA-42 race listings identify Burley as an active filed Republican candidate with no AI policy or AI regulation position found after broader search,https://en.wikipedia.org/wiki/2026_United_States_House_of_Representatives_elections_in_California
Robert Garcia,Co-sponsored the NO FAKES Act to protect voice and likeness rights against AI generated digital replicas,https://robertgarcia.house.gov/media/press-releases/reps-salazar-dean-and-garcia-introduce-bipartisan-no-fakes-act
Robert Garcia,Serves on the House Democratic Commission on AI and Innovation and has a direct legislative record on AI harms,https://robertgarcia.house.gov/media/press-releases/leader-jeffries-announces-new-house-democratic-commission-ai-and-innovation
Philip Turek,Current CA-42 race listings identify Turek as an active filed Republican candidate with no AI policy or AI regulation position found after broader search,https://en.wikipedia.org/wiki/2026_United_States_House_of_Representatives_elections_in_California
Jillian Balow,Campaign launch and profile emphasize education freedom energy independence and conservative priorities with no AI policy or AI regulation position found,https://sheridanmedia.com/news/216894/jillian-balow-joins-the-race-for-wyomings-lone-us-house-seat/
Kevin Christensen,Campaign launch emphasizes leadership energy development and Wyoming values with no AI policy or AI regulation position found,https://wyo4news.com/news/christensen-4th-republican-to-vie-for-u-s-house-seat/
David Giralt,Campaign site emphasizes fossil fuels border security and America First priorities with no AI policy or AI regulation position found,https://davidforwy.com/
Chuck Gray,House candidacy coverage emphasizes election integrity and conservative priorities with no AI policy or AI regulation position found,https://apnews.com/article/5fc88b2a27faf6b10bc536034ef0a3db
Reid Rasner,Campaign launch emphasizes America First lawmaking and conservative economic priorities with no AI policy or AI regulation position found,https://www.yahoo.com/news/articles/reid-rasner-announces-bid-u-024700563.html
Bo Biteman,Public profile and campaign-facing materials emphasize constitutional conservatism and free markets with no AI policy or AI regulation position found,https://www.bobiteman.com/about
David Workman,Candidate coverage identifies an independent House candidacy with no AI policy or AI regulation position found,https://wyo4news.com/news/christensen-4th-republican-to-vie-for-u-s-house-seat/
Scott Fitzgerald,Incumbent WI-05 candidate filing reviewed; no AI policy or AI regulation position found,https://en.wikipedia.org/wiki/2026_United_States_House_of_Representatives_elections_in_Wisconsin
Andrew Beck,Declared WI-05 Democratic candidate; no AI policy or AI regulation position found,https://en.wikipedia.org/wiki/2026_United_States_House_of_Representatives_elections_in_Wisconsin
Ben Steinhoff,Declared WI-05 Democratic candidate; no AI policy or AI regulation position found,https://en.wikipedia.org/wiki/2026_United_States_House_of_Representatives_elections_in_Wisconsin
Glenn Grothman,Incumbent WI-06 candidate filing reviewed; no AI policy or AI regulation position found,https://en.wikipedia.org/wiki/2026_United_States_House_of_Representatives_elections_in_Wisconsin
Jonathan Peetz,Filed WI-06 Republican primary candidacy; no AI policy or AI regulation position found,https://en.wikipedia.org/wiki/2026_United_States_House_of_Representatives_elections_in_Wisconsin
Amanda Bell,Declared WI-06 Democratic candidate; no AI policy or AI regulation position found,https://en.wikipedia.org/wiki/2026_United_States_House_of_Representatives_elections_in_Wisconsin
Kelly Brown,Declared WI-06 Democratic candidate; no AI policy or AI regulation position found,https://en.wikipedia.org/wiki/2026_United_States_House_of_Representatives_elections_in_Wisconsin
John Macho,Declared WI-06 Democratic candidate; no AI policy or AI regulation position found,https://en.wikipedia.org/wiki/2026_United_States_House_of_Representatives_elections_in_Wisconsin
Brad Smith,Declared WI-06 Democratic candidate; no AI policy or AI regulation position found,https://en.wikipedia.org/wiki/2026_United_States_House_of_Representatives_elections_in_Wisconsin
Aaron Wojciechowski,Declared WI-06 Democratic candidate; no AI policy or AI regulation position found,https://en.wikipedia.org/wiki/2026_United_States_House_of_Representatives_elections_in_Wisconsin
Michael Heidenreich,Filed WI-06 Democratic candidacy; no AI policy or AI regulation position found,https://en.wikipedia.org/wiki/2026_United_States_House_of_Representatives_elections_in_Wisconsin
Joey Marschall,Filed WI-06 Democratic candidacy; no AI policy or AI regulation position found,https://en.wikipedia.org/wiki/2026_United_States_House_of_Representatives_elections_in_Wisconsin
Kortney Oldham,Filed WI-06 Democratic candidacy; no AI policy or AI regulation position found,https://en.wikipedia.org/wiki/2026_United_States_House_of_Representatives_elections_in_Wisconsin
Michael Thurow,Declared WI-06 independent candidacy; no AI policy or AI regulation position found,https://www.cookpolitical.com/house/race/485576
Michael Alfonso,Declared WI-07 Republican candidate; no AI policy or AI regulation position found,https://en.wikipedia.org/wiki/2026_United_States_House_of_Representatives_elections_in_Wisconsin
Jessi Ebben,Declared WI-07 Republican candidate; no AI policy or AI regulation position found,https://en.wikipedia.org/wiki/2026_United_States_House_of_Representatives_elections_in_Wisconsin
Kevin Hermening,Declared WI-07 Republican candidate; no AI policy or AI regulation position found,https://en.wikipedia.org/wiki/2026_United_States_House_of_Representatives_elections_in_Wisconsin
Paul Wassgren,Declared WI-07 Republican candidate; no AI policy or AI regulation position found,https://en.wikipedia.org/wiki/2026_United_States_House_of_Representatives_elections_in_Wisconsin
Chris Armstrong,Declared WI-07 Democratic candidate; no AI policy or AI regulation position found,https://en.wikipedia.org/wiki/2026_United_States_House_of_Representatives_elections_in_Wisconsin
Fred Clark,Declared WI-07 Democratic candidate; no AI policy or AI regulation position found,https://en.wikipedia.org/wiki/Fred_Clark_%28politician%29
Tony Wied,Incumbent WI-08 candidacy reviewed; no AI policy or AI regulation position found,https://en.wikipedia.org/wiki/2026_United_States_House_of_Representatives_elections_in_Wisconsin
Rick Crosson,Declared WI-08 Democratic candidate; no AI policy or AI regulation position found,https://en.wikipedia.org/wiki/2026_United_States_House_of_Representatives_elections_in_Wisconsin
Katrina deVille,Declared WI-08 Democratic candidate; no AI policy or AI regulation position found,https://en.wikipedia.org/wiki/2026_United_States_House_of_Representatives_elections_in_Wisconsin
Benjamin Hable,Declared WI-08 Democratic candidate; no AI policy or AI regulation position found,https://en.wikipedia.org/wiki/2026_United_States_House_of_Representatives_elections_in_Wisconsin
Mark Scheffler,Declared WI-08 Democratic candidate; no AI policy or AI regulation position found,https://www.wbay.com/2025/08/26/mark-scheffler-enters-8th-congressional-district-race/
Carol Miller,Incumbent WV-01 campaign and official materials reviewed; no AI policy or AI regulation position found,https://turn4search42.invalid
Larry Jackson,Declared WV-01 Republican challenger; no AI policy or AI regulation position found,https://www.wvns.tv/news/west-virginia-news/local-us-house-of-representatives-candidate-speaks-out-on-wyoming-countys-water-woes/
Chris Reed,Democratic nominee in WV-01 general election coverage; no AI policy or AI regulation position found,https://apnews.com/article/87fb30ed878a9646c063b62acec6e70b
Riley Moore,"Shared AI-generated misinformation about Tim Walz and did not retract it after it was flagged as fake, showing a permissive posture toward deceptive AI use",https://www.thedailybeast.com/gop-rep-gets-worked-up-over-ai-post-of-fake-tim-walz-hating-trump/
Riley Moore,Incumbent WV-02 candidate; no broader AI governance platform found,https://www.cookpolitical.com/house/race/485546
Steve Wendelin,2024 Democratic challenger remained the identifiable opposing candidate for WV-02; no AI policy or AI regulation position found,https://www.yahoo.com/news/riley-moore-wins-u-congress-014131737.html
Adam Smith,"Appointed Eric Horvitz to the National Security Commission on Artificial Intelligence as House Armed Services leader, showing direct engagement with AI policy",https://democrats-armedservices.house.gov/2018/11/smith-and-thornberry-make-appointments-to-artificial-intelligence-commission
Adam Smith,Called for U.S.-China military dialogue on AI and warned about misunderstanding AI capabilities in national security,https://www.ft.com/content/ed2882c0-21c1-423a-ae86-e7e780f7242d
Melissa Chaudhry,Declared WA-09 Democratic candidate; no AI policy or AI regulation position found,https://en.wikipedia.org/wiki/2026_United_States_House_of_Representatives_elections_in_Washington
Kshama Sawant,Independent WA-09 candidacy reviewed; no AI policy or AI regulation position found,https://en.wikipedia.org/wiki/2026_United_States_House_of_Representatives_elections_in_Washington
Janis Clark,Filed WA-09 Republican candidacy; no AI policy or AI regulation position found,https://en.wikipedia.org/wiki/2026_United_States_House_of_Representatives_elections_in_Washington
Mark Greene,Filed WA-09 Republican candidacy; no AI policy or AI regulation position found,https://en.wikipedia.org/wiki/2026_United_States_House_of_Representatives_elections_in_Washington
Marilyn Strickland,Hosted forum on Black innovation and artificial intelligence and discussed federal AI policy plus inclusive entrepreneurship in AI,https://strickland.house.gov/2025/06/04/strickland-hosts-plaskett-for-forum-on-black-innovation-and-artificial-intelligence/
Marilyn Strickland,Supports investment in minority-owned businesses and inclusive growth in emerging tech sectors including AI,https://strickland.house.gov/2025/09/25/strickland-encourages-investments-in-minority-owned-small-businesses/
Adam Arafat,Filed WA-10 Democratic candidacy; no AI policy or AI regulation position found,https://en.wikipedia.org/wiki/2026_United_States_House_of_Representatives_elections_in_Washington
James Walkinshaw,Incumbent VA-11 special-election winner and 2026 candidate materials reviewed; no AI policy or AI regulation position found,https://en.wikipedia.org/wiki/2026_United_States_House_of_Representatives_elections_in_Virginia
Bree Fram,Declared VA-11 Democratic candidate; no AI policy or AI regulation position found,https://en.wikipedia.org/wiki/2026_United_States_House_of_Representatives_elections_in_Virginia
Amy Roma,Filed VA-11 Democratic candidacy; no AI policy or AI regulation position found,https://en.wikipedia.org/wiki/2026_United_States_House_of_Representatives_elections_in_Virginia
Suhas Subramanyam,Incumbent VA-10 candidate materials reviewed; no AI policy or AI regulation position found,https://historical.elections.virginia.gov/elections/view/169546
Mike W. Clancy,General-election Republican candidate in VA-10; no AI policy or AI regulation position found,https://historical.elections.virginia.gov/elections/view/169546
Morgan Griffith,Incumbent VA-09 candidacy reviewed; no AI policy or AI regulation position found,https://en.wikipedia.org/wiki/2026_United_States_House_of_Representatives_elections_in_Virginia
Brandon Cook,Filed VA-09 Republican primary candidacy; no AI policy or AI regulation position found,https://en.wikipedia.org/wiki/2026_United_States_House_of_Representatives_elections_in_Virginia
Douglas Crockett,Declared VA-09 Democratic candidate; no AI policy or AI regulation position found,https://en.wikipedia.org/wiki/2026_United_States_House_of_Representatives_elections_in_Virginia
Joy Powers,Virginia 9th Democrats list Powers as a 2026 U.S. House candidate; no AI policy or AI regulation position found,https://www.va9thdemocrats.org/our-candidates
Adam Murphy,Virginia 9th Democrats list Murphy as a 2026 U.S. House candidate; no AI policy or AI regulation position found,https://www.va9thdemocrats.org/our-candidates
Don Beyer,"Introduced multiple AI and data-center bills, including measures on AI denials and electricity costs from AI data centers",https://beyer.house.gov/news/documentsingle.aspx?DocumentID=6340
Michael Duffin,Declared VA-08 Democratic candidate; no AI policy or AI regulation position found,https://en.wikipedia.org/wiki/2026_United_States_House_of_Representatives_elections_in_Virginia
Frank Ferreira,Declared VA-08 Democratic candidate; no AI policy or AI regulation position found,https://en.wikipedia.org/wiki/2026_United_States_House_of_Representatives_elections_in_Virginia
Mo Seifeldein,Declared VA-08 Democratic candidate; no AI policy or AI regulation position found,https://en.wikipedia.org/wiki/2026_United_States_House_of_Representatives_elections_in_Virginia
Ben Cline,Incumbent VA-06 candidacy and official materials reviewed; no AI policy or AI regulation position found,https://en.wikipedia.org/wiki/2026_United_States_House_of_Representatives_elections_in_Virginia
Pete Barlow,Declared VA-06 Democratic candidate; no AI policy or AI regulation position found,https://www.dnronline.com/news/politics/state_and_regional/democrat-pete-barlow-launches-campaign-for-congress-in-virginias-6th-district/article_317b1880-c1fe-5c3f-be57-344704d6cf16.html
Beth Macy,Declared VA-06 Democratic candidate; no AI policy or AI regulation position found,https://www.wsls.com/news/local/2025/11/18/dopesick-writer-beth-macy-announces-run-for-virginias-6th-district/
Ken Mitchell,Declared VA-06 Democratic candidate; no AI policy or AI regulation position found,https://www.kenmitchellforvirginia.com/news/campaignannouncement
Hugh Murray,Declared VA-06 Democratic candidate; no AI policy or AI regulation position found,https://cardinalnews.org/2026/02/13/third-candidate-enters-the-democratic-race-for-6th-district-nomination/
John McGuire,Incumbent VA-05 campaign and official materials reviewed; no AI policy or AI regulation position found,https://mcguire.house.gov/media/press-releases/rep-john-mcguire-sworn-119th-congress
Melanie Lucero,Declared VA-05 Republican candidate; no AI policy or AI regulation position found,https://www.cbs19news.com/news/melanie-lucero-announces-run-for-virginias-5th-congressional-district/article_10d6ad90-f4ef-11ef-bd17-63f39a7f06cf.html
Suzanne Krzyzanowski,Declared VA-05 Democratic candidate; no AI policy or AI regulation position found,https://www.powhatandemocrats.org/candidate-info
Tom Perriello,Declared VA-05 Democratic candidate; no AI policy or AI regulation position found,https://www.washingtonpost.com/dc-md-va/2025/12/09/perriello-virginia-congress-fifth-district/
Mike Pruitt,Declared VA-05 Democratic candidate; no AI policy or AI regulation position found,https://www.powhatandemocrats.org/candidate-info
Rob Tracinski,Declared VA-05 Democratic candidate; no AI policy or AI regulation position found,https://www.powhatandemocrats.org/candidate-info
Jennifer McClellan,Introduced bipartisan CONSENT Act to ban cyberflashing and transfer of unsolicited AI-generated explicit images,https://mcclellan.house.gov/media/press-releases/mcclellan-moran-schatz-daines-introduce-bipartisan-bicameral-consent-act
Jennifer McClellan,"Congressional art competition rules under McClellan explicitly bar AI-assisted submissions, showing direct attention to AI-generated content issues",https://mcclellan.house.gov/media/press-releases/mcclellan-announces-launch-2026-congressional-art-competition
Bobby Scott,Incumbent VA-03 candidacy and official materials reviewed; no AI policy or AI regulation position found,https://en.wikipedia.org/wiki/2026_United_States_House_of_Representatives_elections_in_Virginia
Justin Maffett,Filed VA-03 Democratic candidacy; no AI policy or AI regulation position found,https://en.wikipedia.org/wiki/2026_United_States_House_of_Representatives_elections_in_Virginia
James Zeb Taylor,Filed VA-03 independent candidacy; no AI policy or AI regulation position found,https://en.wikipedia.org/wiki/2026_United_States_House_of_Representatives_elections_in_Virginia
Becca Balint,Incumbent Vermont at-large candidate filing reviewed; no AI policy or AI regulation position found,https://en.wikipedia.org/wiki/2026_United_States_House_of_Representatives_election_in_Vermont
Mark Coester,Declared Vermont Republican candidate; no AI policy or AI regulation position found,https://en.wikipedia.org/wiki/2026_United_States_House_of_Representatives_election_in_Vermont
Mike Kennedy,Filed UT-04 Republican candidacy under the new map; no AI policy or AI regulation position found,https://vote.utah.gov/2026-candidate-filings/
Tyrone Jensen,Filed UT-04 Republican candidacy; no AI policy or AI regulation position found,https://vote.utah.gov/2026-candidate-filings/
Scott Hatfield,Filed UT-04 Republican candidacy; no AI policy or AI regulation position found,https://vote.utah.gov/2026-candidate-filings/
Seth Stewart,Filed UT-04 Republican candidacy; no AI policy or AI regulation position found,https://vote.utah.gov/2026-candidate-filings/
Jonny Larsen,Filed UT-04 Democratic candidacy; no AI policy or AI regulation position found,https://vote.utah.gov/2026-candidate-filings/
Taylor Wright,Filed UT-04 Libertarian candidacy; no AI policy or AI regulation position found,https://vote.utah.gov/2026-candidate-filings/
Celeste Maloy,Filed UT-03 Republican candidacy; no AI policy or AI regulation position found,https://vote.utah.gov/2026-candidate-filings/
Phil Lyman,Filed UT-03 Republican candidacy; no AI policy or AI regulation position found,https://vote.utah.gov/2026-candidate-filings/
David Harris,Filed UT-03 Republican candidacy; no AI policy or AI regulation position found,https://vote.utah.gov/2026-candidate-filings/
Tyler Murset,Filed UT-03 Republican candidacy; no AI policy or AI regulation position found,https://vote.utah.gov/2026-candidate-filings/
Steven Merrill,Filed UT-03 Democratic candidacy; no AI policy or AI regulation position found,https://vote.utah.gov/2026-candidate-filings/
Blake Moore,"Introduced AI-related bills on using AI to identify redundant regulations and to study rural impacts of AI data centers",https://blakemoore.house.gov/media/press-releases/congressman-blake-moore-introduces-legislation-to-identify-redundant-and-outdated-rules-in-federal-regulations
Karianne Lisonbee,Filed UT-02 Republican candidacy; no AI policy or AI regulation position found,https://vote.utah.gov/2026-candidate-filings/
Tyler Farnsworth,Filed UT-02 Democratic candidacy; no AI policy or AI regulation position found,https://vote.utah.gov/2026-candidate-filings/
Peter Crosby,Filed UT-02 Democratic candidacy; no AI policy or AI regulation position found,https://vote.utah.gov/2026-candidate-filings/
Ben McAdams,Filed UT-01 Democratic candidacy; no AI policy or AI regulation position found,https://vote.utah.gov/2026-candidate-filings/
Michael Farrell,Filed UT-01 Democratic candidacy; no AI policy or AI regulation position found,https://vote.utah.gov/2026-candidate-filings/
Dave Robinson,Filed UT-01 Republican candidacy; no AI policy or AI regulation position found,https://vote.utah.gov/2026-candidate-filings/
Riley Owen,Filed UT-01 Republican candidacy; no AI policy or AI regulation position found,https://vote.utah.gov/2026-candidate-filings/
Jesse West,Filed UT-01 Libertarian candidacy; no AI policy or AI regulation position found,https://vote.utah.gov/2026-candidate-filings/
